{"knowledge_id":"00000000-0000-4000-8000-000000000001","expected_version":1,"source_manifest":{"schema_version":"hybrid-ai/knowledge-source/v1","sources":[{"kind":"procedure","reference":"fixture","artifact_sha256":"aaaaaaaaaaaaaaaaaaaaaaaaaaaaaaaaaaaaaaaaaaaaaaaaaaaaaaaaaaaaaaaa"}]},"criteria":[{"name":"reproduced","passed":true,"observation":"Observed the documented procedure against the referenced fixture."}]}
